job_id,job_title,job_description,required_skills,experience_level
1,Python Developer,"Seeking experienced Python developer for web application development. Must have strong backend knowledge.",Python;Django;PostgreSQL,3+
2,Data Scientist,"Looking for Data Scientist with ML expertise and 5+ years experience in analytics.",Python;Machine Learning;SQL;TensorFlow,5+
3,Full Stack Developer,"Need Full Stack Developer proficient in both frontend and backend technologies.",JavaScript;React;Node.js;MongoDB,3+
4,DevOps Engineer,"Experienced DevOps engineer needed for cloud infrastructure management.",Docker;Kubernetes;AWS;CI/CD,4+
5,Mobile App Developer,"iOS/Android developer required for mobile application development.",React Native;Swift;Kotlin,2+
